{"attribution":"SABR Lahman 2025; Sean Lahman, Bryan Walko and contributors. CC BY-SA 3.0. See docs/DATA_ATTRIBUTION.md.","contextId":"context:37967c8929f1d6369202a1d3f9635f81381fe4ce15ce0e9dab71ac24b3c19174","datasetId":"dataset:1fba260824fe05abec3c5950cd184caa0d314b41f1253bc782f97b678bb28add","engineVersion":"0.4.0","id":"opponents:29182146a03008ee33def9b5474956da826163debf4c1b2b97baab43a9c12ce8","opponentSetKind":"reconstructedFixedLineups","opponents":[{"abbreviation":"ARI","id":"representative:2024:ARI","lineup":[{"id":"representative:2024:ARI:lahman:carroco02","name":"Corbin Carroll","playerId":"lahman:carroco02","profileId":"prepared:2a5d5172050225981fd8915fd24f1a08e605bcf6c27c00c8eb906730fb268929","teamPa":684},{"id":"representative:2024:ARI:lahman:suareeu01","name":"Eugenio Suarez","playerId":"lahman:suareeu01","profileId":"prepared:1bac599a963c41354979b6d5ef0ff91a7c6aa1781ac58d0a025acf7b36ffc12e","teamPa":640},{"id":"representative:2024:ARI:lahman:marteke01","name":"Ketel Marte","playerId":"lahman:marteke01","profileId":"prepared:5b7c9cc7b9e03cdb898e37d4f2bd509962e422b9f7001f6108299558af56a9e3","teamPa":583},{"id":"representative:2024:ARI:lahman:gurrilo01","name":"Lourdes Gurriel","playerId":"lahman:gurrilo01","profileId":"prepared:1007b01d1f037021834f0081b8d919ca7919e7e67f168432b388bfd69f7b9876","teamPa":553},{"id":"representative:2024:ARI:lahman:walkech02","name":"Christian Walker","playerId":"lahman:walkech02","profileId":"prepared:1d1a6ac1fee207931ecb2533229812ed970dc5708ed86f703d47420c56ba85a8","teamPa":552},{"id":"representative:2024:ARI:lahman:mccarja02","name":"Jake McCarthy","playerId":"lahman:mccarja02","profileId":"prepared:a9b3119e2dfeb450ad8fc2094c3756f930ebdf59bb83a9535fe0cfb3a8afbe55","teamPa":495},{"id":"representative:2024:ARI:lahman:pederjo01","name":"Joc Pederson","playerId":"lahman:pederjo01","profileId":"prepared:b6001e4f98a0377ea958f1be1abf9fda2e880128c1ef6ae5e1de40f971a06e74","teamPa":444},{"id":"representative:2024:ARI:lahman:perdoge01","name":"Geraldo Perdomo","playerId":"lahman:perdoge01","profileId":"prepared:4577445d35f80af0c0398d7e9a388a57819ef26408bf9fcab22ce6f610a6fdf0","teamPa":388},{"id":"representative:2024:ARI:lahman:morenga01","name":"Gabriel Moreno","playerId":"lahman:morenga01","profileId":"prepared:fe4cbc214f7d99f8cedbc3087b686845c163e093a6ff44cc47f55bdc4b227834","teamPa":351}],"name":"Arizona Diamondbacks","sourceTeamId":"ARI","year":2024},{"abbreviation":"BAL","id":"representative:2024:BAL","lineup":[{"id":"representative:2024:BAL:lahman:hendegu01","name":"Gunnar Henderson","playerId":"lahman:hendegu01","profileId":"prepared:a173f7ebebe4d52cb583ee8db21a9e3ad5b9a318ee01d33b2df91eeb3b8a992e","teamPa":719},{"id":"representative:2024:BAL:lahman:santaan02","name":"Anthony Santander","playerId":"lahman:santaan02","profileId":"prepared:eaef269bda864e7ac386cc234be544246235b05fe315ea4729af9e2d8e66659f","teamPa":665},{"id":"representative:2024:BAL:lahman:rutscad01","name":"Adley Rutschman","playerId":"lahman:rutscad01","profileId":"prepared:5e1d10d21d731ce017bdc7388168f2d8d1583156ff83a401b336e7e8b96ac370","teamPa":638},{"id":"representative:2024:BAL:lahman:cowseco01","name":"Colton Cowser","playerId":"lahman:cowseco01","profileId":"prepared:710d8261457ff041fd4ce97ae0182de2e4ce3b612a1ce2060ba0f83e2986c8b2","teamPa":561},{"id":"representative:2024:BAL:lahman:mountry01","name":"Ryan Mountcastle","playerId":"lahman:mountry01","profileId":"prepared:0009d7adffb3ad1a4faf1930e62d7b32e0ae0878ca1ff6ca4f08a27a781910f2","teamPa":507},{"id":"representative:2024:BAL:lahman:mullice01","name":"Cedric Mullins","playerId":"lahman:mullice01","profileId":"prepared:ca94487e4bd51aa07aab99718b4f34031401d7f68e354915ec4555338857a4b6","teamPa":494},{"id":"representative:2024:BAL:lahman:ohearry01","name":"Ryan O'Hearn","playerId":"lahman:ohearry01","profileId":"prepared:e0c824d4a3d91c917b528165012b5a01b680aa09e0216eedd9d82e7f76304f50","teamPa":494},{"id":"representative:2024:BAL:lahman:westbjo01","name":"Jordan Westburg","playerId":"lahman:westbjo01","profileId":"prepared:2ffdda8fcbee515d5412ee4924476fc58a06d534f7fd4a5d6d419ba077e4c5c8","teamPa":447},{"id":"representative:2024:BAL:lahman:uriasra01","name":"Ramon Urias","playerId":"lahman:uriasra01","profileId":"prepared:e93aab0276e7d9f6ddb7ac68584b713e05104f7f656ec68afa0525f472374777","teamPa":301}],"name":"Baltimore Orioles","sourceTeamId":"BAL","year":2024},{"abbreviation":"BOS","id":"representative:2024:BOS","lineup":[{"id":"representative:2024:BOS:lahman:duranja01","name":"Jarren Duran","playerId":"lahman:duranja01","profileId":"prepared:86ffa8b09da34acbe0eae0c81d77af4883388f06a9d7cd69bd9d8a1867a391ed","teamPa":735},{"id":"representative:2024:BOS:lahman:deverra01","name":"Rafael Devers","playerId":"lahman:deverra01","profileId":"prepared:c086b0bb55dd4530831e34b26892d047059d122f3078ff4bffd3c2ea64349a3b","teamPa":601},{"id":"representative:2024:BOS:lahman:rafaece01","name":"Ceddanne Rafaela","playerId":"lahman:rafaece01","profileId":"prepared:29312668d0eed92c832c0ddd40a3a53202f45b7f55bd37ad9ad4383b75ca7a62","teamPa":571},{"id":"representative:2024:BOS:lahman:wongco01","name":"Connor Wong","playerId":"lahman:wongco01","profileId":"prepared:273dea8f4310df69d22981be8792f90a20665a91e9ab6225eac71fe9db8fda1c","teamPa":487},{"id":"representative:2024:BOS:lahman:oneilty01","name":"Tyler O'Neill","playerId":"lahman:oneilty01","profileId":"prepared:dde67d0f06ff03d631d648e3a0ffa09d17fe70fca5463ff55bf92728ff8434a5","teamPa":473},{"id":"representative:2024:BOS:lahman:abreuwi02","name":"Wilyer Abreu","playerId":"lahman:abreuwi02","profileId":"prepared:505c37c4ac08bd2be05a08bacd5b7bfa11ada67da57381bad6f4325d9cae4acb","teamPa":447},{"id":"representative:2024:BOS:lahman:yoshima02","name":"Masataka Yoshida","playerId":"lahman:yoshima02","profileId":"prepared:40608575b05590c6ada05f84cd8b28c437befe84e4415109636fa250d129d6c9","teamPa":421},{"id":"representative:2024:BOS:lahman:hamilda03","name":"David Hamilton","playerId":"lahman:hamilda03","profileId":"prepared:3d467b13bd9b83e0ff40e10f379adece2737b97dd71057d5867397e4eaa422c2","teamPa":317},{"id":"representative:2024:BOS:lahman:refsnro01","name":"Rob Refsnyder","playerId":"lahman:refsnro01","profileId":"prepared:882ffed5b8f55e4b3d1b35ea2d83e541c6b8bdf0d89a6f4928681d5b6b704166","teamPa":306}],"name":"Boston Red Sox","sourceTeamId":"BOS","year":2024},{"abbreviation":"CHW","id":"representative:2024:CHA","lineup":[{"id":"representative:2024:CHA:lahman:vaughan01","name":"Andrew Vaughn","playerId":"lahman:vaughan01","profileId":"prepared:a7c0ba4f43af904dc42837a044c820e3e39309c180af041276a33e826cb2109a","teamPa":619},{"id":"representative:2024:CHA:lahman:beninan01","name":"Andrew Benintendi","playerId":"lahman:beninan01","profileId":"prepared:738fbd37a0b6968c861f2e2f945da1f64a76effcec833980d5383115e242d792","teamPa":522},{"id":"representative:2024:CHA:lahman:sheetga01","name":"Gavin Sheets","playerId":"lahman:sheetga01","profileId":"prepared:c06cf2c7f3c8c05dbe143997efccaa047ebd91b5d4b395f4597520a678bfd3f2","teamPa":501},{"id":"representative:2024:CHA:lahman:lopezni01","name":"Nicky Lopez","playerId":"lahman:lopezni01","profileId":"prepared:56c8f5fb88691ea4f8cf6c411d284ddf08e2c0b94d6942102cb038406c81abb2","teamPa":445},{"id":"representative:2024:CHA:lahman:roberlu01","name":"Luis Robert","playerId":"lahman:roberlu01","profileId":"prepared:5686064668fe4d710a06fddfdd4816828e7cdf6b3ec08483c76e30d5d770b537","teamPa":424},{"id":"representative:2024:CHA:lahman:leeko01","name":"Korey Lee","playerId":"lahman:leeko01","profileId":"prepared:268d932d06193d2ce5164f5d56e67bbc85c8c9f8bcb71769e4499cc3d82b6101","teamPa":394},{"id":"representative:2024:CHA:lahman:sosale01","name":"Lenyn Sosa","playerId":"lahman:sosale01","profileId":"prepared:db152b4e3da8eed37eab341b84b3aef11fe6347f8e7fa2854e60bb3e55200a45","teamPa":369},{"id":"representative:2024:CHA:lahman:dejonpa01","name":"Paul DeJong","playerId":"lahman:dejonpa01","profileId":"prepared:dd50fb88aff58ed2d300793d80c6ab3bbab2e347eaaf477a21866aa2a7e04023","teamPa":363},{"id":"representative:2024:CHA:lahman:phamth01","name":"Tommy Pham","playerId":"lahman:phamth01","profileId":"prepared:0427971f9ea89926c2476e35f83c0b8e0fbe6303c3dd42df6f7f3089cd589de4","teamPa":297}],"name":"Chicago White Sox","sourceTeamId":"CHA","year":2024},{"abbreviation":"HOU","id":"representative:2024:HOU","lineup":[{"id":"representative:2024:HOU:lahman:altuvjo01","name":"Jose Altuve","playerId":"lahman:altuvjo01","profileId":"prepared:9242934859d80d330cfa594156b794f2e0691c6d8cda03946d6df45d97c12e05","teamPa":682},{"id":"representative:2024:HOU:lahman:penaje02","name":"Jeremy Peña","playerId":"lahman:penaje02","profileId":"prepared:c7e4148878f98eeb58a299d4ff316901552a1a1510d0c5836e72837840927524","teamPa":650},{"id":"representative:2024:HOU:lahman:alvaryo01","name":"Yordan Alvarez","playerId":"lahman:alvaryo01","profileId":"prepared:9f4ef758baf1f7857b76aff1894e4ccef1d1ae677be5b9f2ce036372328bfd83","teamPa":635},{"id":"representative:2024:HOU:lahman:bregmal01","name":"Alex Bregman","playerId":"lahman:bregmal01","profileId":"prepared:561799cd7320c37ff71dc1bb0db6d2e3b431dc26f029ceff105d0a8669e2a81b","teamPa":634},{"id":"representative:2024:HOU:lahman:diazya02","name":"Yainer Diaz","playerId":"lahman:diazya02","profileId":"prepared:dc7efb4a30fc42a6207a733a3ad45ed95c06234ab111a7a6ca552204d3ad8e29","teamPa":619},{"id":"representative:2024:HOU:lahman:meyerja02","name":"Jake Meyers","playerId":"lahman:meyerja02","profileId":"prepared:d5165b4c0a1845efa79f408eb6afe5dcdbefbb82fd785ae30a139a22c1bf3aa8","teamPa":513},{"id":"representative:2024:HOU:lahman:dubonma01","name":"Mauricio Dubon","playerId":"lahman:dubonma01","profileId":"prepared:1b7bc74564420078220057057d5fc1a83dc20134bc6725eb272d34f8330a330b","teamPa":428},{"id":"representative:2024:HOU:lahman:singljo02","name":"Jon Singleton","playerId":"lahman:singljo02","profileId":"prepared:66fc9cf16e232c2f2cebe22af1e9fd0fda9a927707ec8af01f4e9d838aede202","teamPa":405},{"id":"repre